{
    "$schema": "https://json.schemastore.org/aiproj-1.1.json",
    "Version": "1.1",
    "ProjectName": "ProjectName",
    "ProgrammingLanguage": "CSharp",
    "ScanModules": [
        "VulnerableSourceCode",
        "DataFlowAnalysis",
        "PatternMatching",
        "Components",
        "Configuration"
    ],
    "CustomParameters": null,
    "UseSastRules": false,
    "UseCustomPmRules": false,
    "UseSecurityPolicies": false,
    "SkipGitIgnoreFiles": false,
    "UsePublicAnalysisMethod": true,
    "DownloadDependencies": true,
    "DotNetSettings": {
        "ProjectType": "Solution",
        "SolutionFile": "/var/tmp/servername-1-workdir/70c9f648331363ce/path/to/file.sln"
    },
    "MailingProjectSettings": {
        "Enabled": false,
        "MailProfileName": null,
        "EmailRecipients": []
    }
}
