{
    "$schema": "https://json.schemastore.org/aiproj-1.1.json",
    "Version": "1.1",
    "ProjectName": "WebGoat.NET",
    "ProgrammingLanguage": "CSharp",
    "ScanModules": [
        "VulnerableSourceCode",
        "DataFlowAnalysis",
        "PatternMatching",
        "Configuration"
    ],
    "CustomParameters": null,
    "UseSastRules": false,
    "UseCustomPmRules": false,
    "UseSecurityPolicies": false,
    "SkipGitIgnoreFiles": false,
    "UsePublicAnalysisMethod": true,
    "DownloadDependencies": false,
    "DotNetSettings": {
        "ProjectType": "Solution",
        "SolutionFile": "./src/WebGoat.NET.sln"
    }
}