{
  "$schema": "https://json.schemastore.org/aiproj-1.1.json",
  "Version": "1.1",
  "ProjectName": "WebGoat.NET",
  "ProgrammingLanguage": "Java",
  "ScanModules": [
    "VulnerableSourceCode",
    "DataFlowAnalysis",
    "PatternMatching",
    "Components",
    "Configuration",
    "BlackBox"
  ],
  "CustomParameters": "--log-level=trace",
  "UseSastRules": false,
  "UseCustomPmRules": false,
  "UseSecurityPolicies": true,
  "SkipGitIgnoreFiles": false,
  "UsePublicAnalysisMethod": true,
  "DownloadDependencies": true,
  "DotNetSettings": {
    "ProjectType": "Solution",
    "SolutionFile": "./WebGoat.NET.sln"
  },
  "JavaSettings": {
    "Parameters": "-Dfile.encoding=UTF-8",
    "UnpackUserPackages": true,
    "UserPackagePrefixes": "com.ptsecurity.appsec",
    "Version": "v1_11"
  },
  "BlackBoxSettings": {
    "Site": "https://test.ptdemo.local",
    "Level": "Full",
    "SslCheck": true,
    "ScanScope": "Domain",
    "BlackListedAddresses": [
      {
        "Format": "Wildcard",
        "Address": "https://test.ptdemo.local/admin/*"
      },
      {
        "Format": "ExactMatch",
        "Address": "https://test.ptdemo.local/setup"
      }
    ],
    "WhiteListedAddresses": [
      {
        "Format": "ExactMatch",
        "Address": "https://test.ptdemo.local/sales"
      },
      {
        "Format": "Wildcard",
        "Address": "https://test.ptdemo.local/users/*"
      }
    ],
    "AdditionalHttpHeaders": [
      {
        "Key": "custom-header",
        "Value": "custom-value"
      },
      {
        "Key": "ptai-scan",
        "Value": "ptai-scan-header-value"
      }
    ],
    "Authentication": {
      "Type": "Form",
      "Form": {
        "FormDetection": "Manual",
        "LoginKey": "username",
        "PasswordKey": "password",
        "Login": "admin",
        "Password": "P@ssw0rd",
        "FormAddress": "https://test.ptdemo.local/login",
        "FormXPath": "/html/body/form",
        "ValidationTemplate": "Welcome"
      }
    },
    "ProxySettings": {
      "Enabled": true,
      "Type": "Http",
      "Host": "proxy.ptdemo.local",
      "Port": 3128,
      "Login": "admin",
      "Password": "P@ssw0rd"
    },
    "RunAutocheckAfterScan": true
  },
  "MailingProjectSettings": {
    "Enabled": true,
    "MailProfileName": "PTDemo",
    "EmailRecipients": [
      "developer@ptdemo.local",
      "ciso@ptdemo.local"
    ]
  }
}